{
  "analysis_date": "2025-06-01",
  "approval_status": "pending_human_review",
  "audit": {
    "complete": true,
    "coverage": {
      "inputs_bound": 0,
      "inputs_unverified": 8,
      "inputs_verified": 0,
      "witnesses_attempted": 1,
      "witnesses_replayed": 1
    },
    "errors": [],
    "failed_levels": [],
    "halted": false,
    "inputs_bound": 0,
    "inputs_unverified": 8,
    "inputs_verified": 0,
    "levels": {
      "calculation_replay": "passed",
      "completeness": "passed",
      "envelope_integrity": "passed",
      "final_artifacts": "passed",
      "graph_and_contracts": "passed",
      "source_reconstruction": "not_applicable"
    },
    "overall_state": "verified",
    "unavailable": [
      "A3 BeneishM witness input 'dsri' (1.0) cites no source fact; its value is unverified against any typed fact",
      "A3 BeneishM witness input 'gmi' (1.0) cites no source fact; its value is unverified against any typed fact",
      "A3 BeneishM witness input 'aqi' (1.0) cites no source fact; its value is unverified against any typed fact",
      "A3 BeneishM witness input 'sgi' (1.0) cites no source fact; its value is unverified against any typed fact",
      "A3 BeneishM witness input 'depi' (1.0) cites no source fact; its value is unverified against any typed fact",
      "A3 BeneishM witness input 'sgai' (1.0) cites no source fact; its value is unverified against any typed fact",
      "A3 BeneishM witness input 'lvgi' (1.0) cites no source fact; its value is unverified against any typed fact",
      "A3 BeneishM witness input 'tata' (0.0) cites no source fact; its value is unverified against any typed fact"
    ],
    "warnings": [],
    "witnesses_attempted": 1,
    "witnesses_replayed": 1
  },
  "calculations": [
    {
      "calculator_id": "beneish_m_score",
      "formula_id": "beneish_m_score",
      "formula_version": "2.0.0",
      "input_fact_ids": {},
      "inputs": {
        "aqi": 1.0,
        "depi": 1.0,
        "dsri": 1.0,
        "gmi": 1.0,
        "lvgi": 1.0,
        "sgai": 1.0,
        "sgi": 1.0,
        "tata": 0.0
      },
      "notes": "Unrounded score; display rounding is a separate presentation step.",
      "parameters": {
        "formula_source": "ECB Occasional Paper 385, Equation 2, p.10 (eight-variable Beneish M-Score)",
        "screening_threshold": -1.78,
        "threshold_policy": "ecb-385-eq2-conventional"
      },
      "provenance": "deterministic",
      "result": -2.4799999999999995,
      "units": {
        "aqi": "ratio",
        "depi": "ratio",
        "dsri": "ratio",
        "gmi": "ratio",
        "lvgi": "ratio",
        "sgai": "ratio",
        "sgi": "ratio",
        "tata": "ratio"
      }
    }
  ],
  "claims": [
    {
      "agent_id": "A6B",
      "calculation_ids": [],
      "category": "bull_thesis",
      "details": null,
      "evidence": [
        "A2.PEER_LIST",
        "A3.AltmanZ"
      ],
      "fact_ids": [],
      "id": "B1",
      "impact": "Topline revenue CAGR +15%",
      "probability": null,
      "severity": null,
      "statement": "Enterprise Cloud Expansion",
      "thesis": "Enterprise Cloud Expansion"
    },
    {
      "agent_id": "A6B",
      "calculation_ids": [],
      "category": "bull_thesis",
      "details": null,
      "evidence": [
        "A3.OCF_vs_NI_Flag"
      ],
      "fact_ids": [],
      "id": "B2",
      "impact": "Operating margin +200 bps",
      "probability": null,
      "severity": null,
      "statement": "Operating Margin Leverage",
      "thesis": "Operating Margin Leverage"
    },
    {
      "agent_id": "A6B",
      "calculation_ids": [],
      "category": "bull_thesis",
      "details": null,
      "evidence": [
        "A5.SentimentSplit"
      ],
      "fact_ids": [],
      "id": "B3",
      "impact": "FCF per share +12% annualized",
      "probability": null,
      "severity": null,
      "statement": "Capital Return Acceleration",
      "thesis": "Capital Return Acceleration"
    },
    {
      "agent_id": "A6R",
      "calculation_ids": [],
      "category": "bear_rebuttal",
      "details": {
        "bull_id": "B1"
      },
      "evidence": [],
      "fact_ids": [],
      "id": "bear_rebuttal_B1",
      "impact": null,
      "probability": "Med",
      "severity": "Med",
      "statement": "Macro enterprise IT budget scrutiny could delay expansion cycles.",
      "thesis": null
    },
    {
      "agent_id": "A6R",
      "calculation_ids": [],
      "category": "bear_rebuttal",
      "details": {
        "bull_id": "B2"
      },
      "evidence": [],
      "fact_ids": [],
      "id": "bear_rebuttal_B2",
      "impact": null,
      "probability": "Low",
      "severity": "High",
      "statement": "AI compute capex and engineer hiring costs could compress gross margins.",
      "thesis": null
    },
    {
      "agent_id": "A6R",
      "calculation_ids": [],
      "category": "bear_rebuttal",
      "details": {
        "bull_id": "B3"
      },
      "evidence": [],
      "fact_ids": [],
      "id": "bear_rebuttal_B3",
      "impact": null,
      "probability": "Med",
      "severity": "Med",
      "statement": "Multiple de-rating could offset share repurchases if revenue guidance softens.",
      "thesis": null
    },
    {
      "agent_id": "A6",
      "calculation_ids": [],
      "category": "danger_zone",
      "details": {
        "category": "Accounting anomalies",
        "flag": "🟢",
        "note": "Clean accruals and cash conversion",
        "sources": [
          "A3.BeneishM",
          "A3.OCF_vs_NI_Flag"
        ]
      },
      "evidence": [],
      "fact_ids": [],
      "id": "danger_Accounting anomalies",
      "impact": null,
      "probability": null,
      "severity": "🟢",
      "statement": "Accounting anomalies: 🟢 - Clean accruals and cash conversion",
      "thesis": null
    },
    {
      "agent_id": "A6",
      "calculation_ids": [],
      "category": "danger_zone",
      "details": {
        "category": "Customer concentration",
        "flag": "🟢",
        "note": "No single customer exceeds 10%",
        "sources": [
          "A2.TopCustomerPct"
        ]
      },
      "evidence": [],
      "fact_ids": [],
      "id": "danger_Customer concentration",
      "impact": null,
      "probability": null,
      "severity": "🟢",
      "statement": "Customer concentration: 🟢 - No single customer exceeds 10%",
      "thesis": null
    },
    {
      "agent_id": "A6",
      "calculation_ids": [],
      "category": "danger_zone",
      "details": {
        "category": "Litigation & regulatory",
        "flag": "🟢",
        "note": "No pending class actions",
        "sources": [
          "A5.MajorLitigation"
        ]
      },
      "evidence": [],
      "fact_ids": [],
      "id": "danger_Litigation & regulatory",
      "impact": null,
      "probability": null,
      "severity": "🟢",
      "statement": "Litigation & regulatory: 🟢 - No pending class actions",
      "thesis": null
    },
    {
      "agent_id": "A6",
      "calculation_ids": [],
      "category": "danger_zone",
      "details": {
        "category": "Hype vs reality",
        "flag": "🟢",
        "note": "Valuation supported by cash flow fundamentals",
        "sources": [
          "A3.HypeFlag"
        ]
      },
      "evidence": [],
      "fact_ids": [],
      "id": "danger_Hype vs reality",
      "impact": null,
      "probability": null,
      "severity": "🟢",
      "statement": "Hype vs reality: 🟢 - Valuation supported by cash flow fundamentals",
      "thesis": null
    },
    {
      "agent_id": "A6",
      "calculation_ids": [],
      "category": "danger_zone",
      "details": {
        "category": "Balance sheet shock buffer",
        "flag": "🟢",
        "note": "Altman Z safe zone cushion",
        "sources": [
          "A3.AltmanZ"
        ]
      },
      "evidence": [],
      "fact_ids": [],
      "id": "danger_Balance sheet shock buffer",
      "impact": null,
      "probability": null,
      "severity": "🟢",
      "statement": "Balance sheet shock buffer: 🟢 - Altman Z safe zone cushion",
      "thesis": null
    },
    {
      "agent_id": "A6",
      "calculation_ids": [],
      "category": "catalyst",
      "details": null,
      "evidence": [],
      "fact_ids": [],
      "id": "catalyst_1",
      "impact": null,
      "probability": null,
      "severity": null,
      "statement": "Next-generation enterprise platform launch",
      "thesis": null
    },
    {
      "agent_id": "A6",
      "calculation_ids": [],
      "category": "catalyst",
      "details": null,
      "evidence": [],
      "fact_ids": [],
      "id": "catalyst_2",
      "impact": null,
      "probability": null,
      "severity": null,
      "statement": "Analyst day investor presentation and long-term margin target updates",
      "thesis": null
    },
    {
      "agent_id": "A6",
      "calculation_ids": [],
      "category": "catalyst",
      "details": null,
      "evidence": [],
      "fact_ids": [],
      "id": "catalyst_3",
      "impact": null,
      "probability": null,
      "severity": null,
      "statement": "International datacenter footprint deployment",
      "thesis": null
    },
    {
      "agent_id": "A6",
      "calculation_ids": [],
      "category": "headwind",
      "details": null,
      "evidence": [],
      "fact_ids": [],
      "id": "headwind_1",
      "impact": null,
      "probability": null,
      "severity": null,
      "statement": "Foreign exchange headwinds in EMEA region",
      "thesis": null
    },
    {
      "agent_id": "A6",
      "calculation_ids": [],
      "category": "headwind",
      "details": null,
      "evidence": [],
      "fact_ids": [],
      "id": "headwind_2",
      "impact": null,
      "probability": null,
      "severity": null,
      "statement": "Elevated enterprise IT scrutiny for non-essential software",
      "thesis": null
    },
    {
      "agent_id": "A7",
      "calculation_ids": [],
      "category": "scorecard",